{
  "slug": "kleinanzeigen",
  "title": "Selected Work",
  "subtitle": "Coordination between people who have never met, design systems that ship to production, and color that stays readable for everyone",
  "theme": "default",
  "show_all_label": "Show more work",
  "bio": {
    "short": "I'm Tobias Treppmann, a product designer in Berlin. My work centers on systems that are complicated underneath and have to feel simple on top: a booking system holding four parties together, filter logic over datasets too large to query whole, and a design system that ships tokens to production rather than to Figma. I run my own research, in German and in English.",
    "long": "I'm Tobias Treppmann, a product designer in Berlin.\n\nMost of my work has been on systems that are complicated underneath and have to feel obvious on the surface. At ChurchDesk I designed a booking system that held funeral homes, pastors and cemeteries together across twenty-plus locations and cut coordination from days of phone-tag to hours. At Datameer I spent five years on filter logic, pivot tables and result cards for analysts at banks and insurers, including the awkward problem of a preview that reports nothing while the data is sitting there. At Bibel TV I did the work rather than assign it — the design system ships as a live token API across web, iOS, Android and Figma, and I was adding an MCP layer so people who aren't designers can use it without breaking it.\n\nI run my own research sessions, in German and in English. I've also spent ten years mentoring designers, which is the part of the job I'd miss most if it went away.",
    "context": {
      "company": "Kleinanzeigen (Adevinta) — Germany's largest classifieds marketplace",
      "role": "Senior Product Designer, Real Estate vertical — an individual contributor role, 18-month parental leave cover",
      "emphasis": "Hands-on product design, in the first person. Complex systems made simple. Design systems built from scratch. Filter and search interfaces. Two-sided marketplaces. Research run personally, in German and English. Hands-on delivery at Bibel TV."
    }
  },
  "case_studies": [
    {
      "id": "churchdesk-booking-system",
      "visibility": "featured",
      "order": 1,
      "format_override": "in-depth"
    },
    {
      "id": "bibeltv-design-system-api",
      "visibility": "featured",
      "order": 2,
      "format_override": "in-depth"
    },
    {
      "id": "bibeltv-color-api",
      "visibility": "featured",
      "order": 3,
      "format_override": "in-depth"
    },
    {
      "id": "datameer-data-dense-analytics",
      "visibility": "browseable",
      "order": 4,
      "format_override": "in-depth"
    },
    {
      "id": "spreadshirt-user-research-strategy",
      "visibility": "browseable",
      "order": 5,
      "format_override": "in-depth"
    },
    {
      "id": "bibeltv-app-redesign",
      "visibility": "browseable",
      "order": 6,
      "format_override": "in-depth"
    },
    {
      "id": "bibeltv-ai-prototyping",
      "visibility": "browseable",
      "order": 7,
      "format_override": "executive"
    },
    {
      "id": "leading-a-team-is-a-design-problem",
      "visibility": "hidden",
      "order": 8,
      "format_override": "executive"
    }
  ]
}
