{
  "slug": "jupus",
  "title": "Selected Work",
  "subtitle": "AI product design for complex B2B workflows, with design leadership behind it.",
  "theme": "default",
  "case_studies": [
    {
      "id": "ninox-ai-onboarding",
      "visibility": "featured",
      "order": 1,
      "format_override": "in-depth"
    },
    {
      "id": "churchdesk-booking-system",
      "visibility": "featured",
      "order": 2,
      "format_override": "in-depth"
    },
    {
      "id": "bibeltv-color-api",
      "visibility": "featured",
      "order": 3,
      "format_override": "executive"
    },
    {
      "id": "bibeltv-support-agent",
      "visibility": "browseable",
      "order": 5,
      "format_override": "executive"
    },
    {
      "id": "datameer-data-dense-analytics",
      "visibility": "hidden",
      "order": 6
    },
    {
      "id": "bibeltv-ai-prototyping",
      "visibility": "hidden",
      "order": 7
    },
    {
      "id": "spreadshirt-user-research-strategy",
      "visibility": "hidden",
      "order": 8
    }
  ],
  "show_all_label": "Show more work"
}
