{
  "slug": "liveeo",
  "title": "Selected Work",
  "subtitle": "Enterprise analytics, design systems as infrastructure, and competitive redesign",
  "theme": "default",
  "show_all_label": "Show more work",
  "case_studies": [
    {
      "id": "churchdesk-booking-system",
      "visibility": "featured",
      "order": 1,
      "format_override": "in-depth"
    },
    {
      "id": "bibeltv-color-api",
      "visibility": "featured",
      "order": 2,
      "format_override": "executive"
    },
    {
      "id": "bibeltv-design-system-api",
      "visibility": "featured",
      "order": 3,
      "format_override": "in-depth"
    },
    {
      "id": "bibeltv-app-redesign",
      "visibility": "browseable",
      "order": 4,
      "format_override": "in-depth"
    },
    {
      "id": "bibeltv-ai-prototyping",
      "visibility": "browseable",
      "order": 5,
      "format_override": "in-depth"
    },
    {
      "id": "datameer-data-dense-analytics",
      "visibility": "browseable",
      "order": 6,
      "format_override": "executive"
    },
    {
      "id": "leading-a-team-is-a-design-problem",
      "visibility": "browseable",
      "order": 7,
      "format_override": "executive"
    },
    {
      "id": "spreadshirt-user-research-strategy",
      "visibility": "hidden",
      "order": 8,
      "format_override": "blog"
    }
  ]
}
