{
  "slug": "zalando-engineering-manager-ai-innovation",
  "title": "Selected Work",
  "subtitle": "An AI product shipped in production, with prototype-versus-production discipline and a consumer-scale KPI history behind it.",
  "theme": "default",
  "case_studies": [
    {
      "id": "bibeltv-support-agent",
      "visibility": "featured",
      "order": 1,
      "format_override": "in-depth"
    },
    {
      "id": "churchdesk-booking-system",
      "visibility": "featured",
      "order": 2,
      "format_override": "in-depth"
    },
    {
      "id": "ninox-ai-onboarding",
      "visibility": "browseable",
      "order": 4,
      "format_override": "executive"
    },
    {
      "id": "bibeltv-design-system-api",
      "visibility": "browseable",
      "order": 5,
      "format_override": "executive"
    },
    {
      "id": "spreadshirt-user-research-strategy",
      "visibility": "hidden",
      "order": 6
    },
    {
      "id": "datameer-data-dense-analytics",
      "visibility": "hidden",
      "order": 8
    },
    {
      "id": "bibeltv-app-redesign",
      "visibility": "hidden",
      "order": 9
    },
    {
      "id": "bibeltv-color-api",
      "visibility": "hidden",
      "order": 10
    },
    {
      "id": "bibeltv-ai-prototyping",
      "visibility": "hidden",
      "order": 11
    }
  ],
  "show_all_label": "Show more work"
}
