{
  "slug": "deliveryhero",
  "title": "Selected Work",
  "subtitle": "I shipped an AI copilot for customer-support teams; the rest of the selection is coordination across many stakeholders and leadership as system design.",
  "theme": "default",
  "case_studies": [
    {
      "id": "bibeltv-support-agent",
      "visibility": "featured",
      "order": 1,
      "format_override": "in-depth"
    },
    {
      "id": "leading-a-team-is-a-design-problem",
      "visibility": "featured",
      "order": 2,
      "format_override": "in-depth"
    },
    {
      "id": "churchdesk-booking-system",
      "visibility": "featured",
      "order": 4,
      "format_override": "in-depth"
    },
    {
      "id": "ninox-ai-onboarding",
      "visibility": "browseable",
      "order": 5,
      "format_override": "executive"
    },
    {
      "id": "spreadshirt-user-research-strategy",
      "visibility": "browseable",
      "order": 6,
      "format_override": "executive"
    },
    {
      "id": "bibeltv-design-system-api",
      "visibility": "hidden",
      "order": 7
    },
    {
      "id": "datameer-data-dense-analytics",
      "visibility": "hidden",
      "order": 9
    },
    {
      "id": "bibeltv-app-redesign",
      "visibility": "hidden",
      "order": 10
    },
    {
      "id": "bibeltv-color-api",
      "visibility": "hidden",
      "order": 11
    },
    {
      "id": "bibeltv-ai-prototyping",
      "visibility": "hidden",
      "order": 12
    }
  ],
  "show_all_label": "Show more work"
}
