{
  "slug": "xentral",
  "title": "Selected Work",
  "subtitle": "AI agents in production, plus no-code ERP and workflow automation for SMEs.",
  "theme": "default",
  "case_studies": [
    {
      "id": "ninox-ai-onboarding",
      "visibility": "featured",
      "order": 1,
      "format_override": "in-depth"
    },
    {
      "id": "bibeltv-support-agent",
      "visibility": "featured",
      "order": 2,
      "format_override": "in-depth"
    },
    {
      "id": "churchdesk-booking-system",
      "visibility": "featured",
      "order": 3,
      "format_override": "in-depth"
    },
    {
      "id": "bibeltv-design-system-api",
      "visibility": "browseable",
      "order": 5,
      "format_override": "executive"
    },
    {
      "id": "datameer-data-dense-analytics",
      "visibility": "hidden",
      "order": 7
    },
    {
      "id": "spreadshirt-user-research-strategy",
      "visibility": "hidden",
      "order": 8
    },
    {
      "id": "bibeltv-app-redesign",
      "visibility": "hidden",
      "order": 9
    },
    {
      "id": "bibeltv-color-api",
      "visibility": "hidden",
      "order": 10
    },
    {
      "id": "bibeltv-ai-prototyping",
      "visibility": "hidden",
      "order": 11
    }
  ],
  "show_all_label": "Show more work"
}
