{
  "slug": "goodmaven-ai-design-leader",
  "title": "Selected Work",
  "subtitle": "I shipped an AI copilot skill and built an AI fundraising ecosystem end to end; the prompt-to-database onboarding I co-defined with the founders.",
  "theme": "default",
  "case_studies": [
    {
      "id": "bibeltv-support-agent",
      "visibility": "featured",
      "order": 1,
      "format_override": "in-depth"
    },
    {
      "id": "ai-fundraising-letters",
      "visibility": "featured",
      "order": 2,
      "format_override": "in-depth"
    },
    {
      "id": "ninox-ai-onboarding",
      "visibility": "featured",
      "order": 3,
      "format_override": "in-depth"
    },
    {
      "id": "bibeltv-design-system-api",
      "visibility": "browseable",
      "order": 5,
      "format_override": "executive"
    },
    {
      "id": "churchdesk-booking-system",
      "visibility": "browseable",
      "order": 7,
      "format_override": "executive"
    },
    {
      "id": "bibeltv-ai-prototyping",
      "visibility": "hidden",
      "order": 8
    },
    {
      "id": "bibeltv-app-redesign",
      "visibility": "hidden",
      "order": 9
    },
    {
      "id": "bibeltv-color-api",
      "visibility": "hidden",
      "order": 10
    },
    {
      "id": "datameer-data-dense-analytics",
      "visibility": "hidden",
      "order": 11
    },
    {
      "id": "spreadshirt-user-research-strategy",
      "visibility": "hidden",
      "order": 12
    }
  ],
  "show_all_label": "Show more work"
}
