{
  "slug": "fin-ai-design-leader",
  "title": "Selected Work",
  "subtitle": "AI copilot skill shipped, an AI fundraising ecosystem built end-to-end, prompt-to-database onboarding co-defined with founders — selected for Fin",
  "theme": "default",
  "case_studies": [
    {
      "id": "bibeltv-support-agent",
      "visibility": "featured",
      "order": 1,
      "format_override": "in-depth"
    },
    {
      "id": "bibeltv-ai-fundraising",
      "visibility": "featured",
      "order": 2,
      "format_override": "in-depth"
    },
    {
      "id": "ninox-ai-onboarding",
      "visibility": "featured",
      "order": 3,
      "format_override": "in-depth"
    },
    {
      "id": "bibeltv-agentic-engineering",
      "visibility": "browseable",
      "order": 4,
      "format_override": "executive"
    },
    {
      "id": "bibeltv-design-system-api",
      "visibility": "browseable",
      "order": 5,
      "format_override": "executive"
    },
    {
      "id": "ninox-org-building",
      "visibility": "browseable",
      "order": 6,
      "format_override": "executive"
    },
    {
      "id": "churchdesk-booking-system",
      "visibility": "browseable",
      "order": 7,
      "format_override": "executive"
    },
    {
      "id": "bibeltv-ai-prototyping",
      "visibility": "hidden",
      "order": 8
    },
    {
      "id": "bibeltv-app-redesign",
      "visibility": "hidden",
      "order": 9
    },
    {
      "id": "bibeltv-color-api",
      "visibility": "hidden",
      "order": 10
    },
    {
      "id": "datameer-data-dense-analytics",
      "visibility": "hidden",
      "order": 11
    },
    {
      "id": "spreadshirt-user-research-strategy",
      "visibility": "hidden",
      "order": 12
    }
  ],
  "show_all_label": "Show more work",
  "cv": {
    "href": "/documents/tobias-treppmann-cv-fin-ai-design-leader.pdf",
    "label": "Download CV (PDF)",
    "note": ""
  }
}
