{
  "slug": "mobile-de",
  "title": "Selected Work",
  "subtitle": "Consumer and marketplace UX at the center, with design systems at scale and design leadership behind it.",
  "theme": "default",
  "case_studies": [
    {
      "id": "bibeltv-app-redesign",
      "visibility": "featured",
      "order": 1,
      "format_override": "in-depth"
    },
    {
      "id": "bibeltv-design-system-api",
      "visibility": "featured",
      "order": 2,
      "format_override": "in-depth"
    },
    {
      "id": "leading-a-team-is-a-design-problem",
      "visibility": "featured",
      "order": 3,
      "format_override": "in-depth"
    },
    {
      "id": "ninox-ai-onboarding",
      "visibility": "browseable",
      "order": 4,
      "format_override": "in-depth"
    },
    {
      "id": "spreadshirt-user-research-strategy",
      "visibility": "browseable",
      "order": 5,
      "format_override": "executive"
    },
    {
      "id": "churchdesk-booking-system",
      "visibility": "browseable",
      "order": 6,
      "format_override": "executive"
    },
    {
      "id": "bibeltv-color-api",
      "visibility": "hidden",
      "order": 7
    },
    {
      "id": "datameer-data-dense-analytics",
      "visibility": "hidden",
      "order": 8
    }
  ],
  "show_all_label": "Show more work"
}
