{
  "slug": "horvath-senior-consultant-kirche-nonprofit",
  "title": "Ausgewählte Arbeiten",
  "subtitle": "Kirchen-Domäne, Digitalisierung organisatorischer Kernprozesse, innovative Tools im Non-Profit-Kontext — kuratiert für Horváth",
  "theme": "default",
  "case_studies": [
    {
      "id": "churchdesk-booking-system",
      "visibility": "featured",
      "order": 1,
      "format_override": "in-depth"
    },
    {
      "id": "bibeltv-app-redesign",
      "visibility": "featured",
      "order": 3,
      "format_override": "in-depth"
    },
    {
      "id": "bibeltv-support-agent",
      "visibility": "browseable",
      "order": 4,
      "format_override": "executive"
    },
    {
      "id": "datameer-data-dense-analytics",
      "visibility": "browseable",
      "order": 5,
      "format_override": "executive"
    },
    {
      "id": "bibeltv-design-system-api",
      "visibility": "browseable",
      "order": 6,
      "format_override": "executive"
    },
    {
      "id": "bibeltv-color-api",
      "visibility": "hidden",
      "order": 7
    },
    {
      "id": "bibeltv-ai-prototyping",
      "visibility": "hidden",
      "order": 9
    },
    {
      "id": "ninox-ai-onboarding",
      "visibility": "hidden",
      "order": 10
    },
    {
      "id": "spreadshirt-user-research-strategy",
      "visibility": "hidden",
      "order": 11
    }
  ],
  "show_all_label": "Weitere Arbeiten anzeigen"
}
