{
  "slug": "dayone-ai-experience-designer",
  "title": "Selected Work",
  "subtitle": "AI workflows in production, and prototypes engineering consumes on top of design systems that run as deployed APIs.",
  "theme": "default",
  "case_studies": [
    {
      "id": "bibeltv-design-system-api",
      "visibility": "featured",
      "order": 2,
      "format_override": "in-depth"
    },
    {
      "id": "bibeltv-support-agent",
      "visibility": "featured",
      "order": 3,
      "format_override": "executive"
    },
    {
      "id": "ninox-ai-onboarding",
      "visibility": "browseable",
      "order": 4,
      "format_override": "in-depth"
    },
    {
      "id": "churchdesk-booking-system",
      "visibility": "browseable",
      "order": 5,
      "format_override": "executive"
    },
    {
      "id": "bibeltv-ai-prototyping",
      "visibility": "hidden",
      "order": 6
    },
    {
      "id": "bibeltv-color-api",
      "visibility": "hidden",
      "order": 7
    },
    {
      "id": "bibeltv-app-redesign",
      "visibility": "hidden",
      "order": 8
    },
    {
      "id": "datameer-data-dense-analytics",
      "visibility": "hidden",
      "order": 10
    },
    {
      "id": "spreadshirt-user-research-strategy",
      "visibility": "hidden",
      "order": 11
    }
  ],
  "show_all_label": "Show more work"
}
